{
  "$schema": "./config.schema.json",
  "site": {
    "title": "From Reviewable to Reviewed: A Dialectical Standard of Care for Nurse- and Physician-Facing Clinical AI",
    "displayTitle": "From Reviewable to Reviewed: <span class=\"title-sub\">A Dialectical Standard of Care for Nurse- and Physician-Facing Clinical AI</span>",
    "venue": "AAAI 2026 Fall Symposium Series · AT-AI4H-NW 2026",
    "description": "A procedural standard of care for clinical AI oversight. Dialectical review specifies clinician review as a performed and recorded act, with four conditions and a rule for allocating responsibility among vendor, institution, and clinician.",
    "keywords": "Clinical AI, Human Oversight, Automation Bias, Standard of Care, Dialectical Review, Clinical Decision Support, EU AI Act, FDA, Medical Device Regulation, Liability, Nursing, Sepsis Alerting, AAAI Fall Symposium Series 2026",
    "favicon": "favicon.ico",
    "lang": "en",
    "url": "",
    "publicationDate": "2026"
  },
  "authors": [
    {
      "name": "Aizierjiang Aiersilan",
      "url": "https://ezharjan.github.io/",
      "affiliations": [
        1
      ]
    }
  ],
  "affiliations": [
    {
      "id": 1,
      "name": "The George Washington University"
    }
  ],
  "links": [
    {
      "type": "arxiv",
      "label": "arXiv",
      "icon": "ai ai-arxiv",
      "url": "https://arxiv.org/abs/2606.00044",
      "enabled": true
    },
    {
      "type": "confab",
      "label": "Confab",
      "icon": "fas fa-calendar-check",
      "url": "https://cal.com/ezhar/30min",
      "enabled": true
    },
    {
      "type": "slides",
      "label": "Slides",
      "icon": "fas fa-chalkboard-teacher",
      "url": "A_Dialectical_Standard_of_Care_AizierjiangAiersilan_silides4AAAI2026FSS.pdf",
      "enabled": true
    },
    {
      "type": "paper",
      "label": "Paper",
      "icon": "fas fa-file-pdf",
      "url": "https://aaai.org/conference/fall-symposia/2026-fall-symposium-series-2/",
      "enabled": true
    }
  ],
  "abstract": {
    "title": "Abstract",
    "body": "United States and European Union law both make clinician review load-bearing without requiring that it be performed. The United States statutory clinical decision support exclusion conditions a system’s escape from device regulation on whether a clinician can independently review the basis for a recommendation, and Article 14 of the EU AI Act requires high-risk systems to be supplied so that overseers <i>can</i> remain aware of automation bias. Each provision is framed as a system capability rather than a performed act, and thus can be satisfied by a system that is reviewable in principle yet unreviewed in fact. Controlled studies locate the failure mode there: the accuracy of highly experienced radiologists fell from 82.3% to 45.5% when a purported AI supplied incorrect BI-RADS suggestions; in a separate experiment, explanations paired with incorrect recommendations reduced clinician accuracy rather than protecting against error. We argue that closing the gap requires specifying oversight as a <i>dialectical review</i> with four conditions: an independent prior assessment recorded before the output is seen, disclosure of the basis at decision-relevant granularity, a recorded disposition, and a consequence rule that turns the aggregated record into revalidation duties and evidence for allocating responsibility among vendor, institution, and clinician. We motivate these conditions by scoping the argument to three classes of deployed systems with distinct failure modes and by separating Lessig’s account of architecture as regulation from the claim that trained models cannot be audited against rules. We then apply the conditions to nurse-facing deterioration alerting, where clinician-AI dyads already operate at scale; test the framing against the patient’s position; and state the proposal’s limits."
  },
  "sections": [
    {
      "type": "list",
      "title": "Contributions",
      "ordered": true,
      "align": "left",
      "items": [
        "<b>A scoped object of governance.</b> The argument is confined to three classes of deployed clinical AI with distinct failure modes, and the clinician-AI dyad is defined operationally as a named clinician paired with a deployed system instance ⟨<i>m</i>, <i>v</i>, <i>c</i>⟩.",
        "<b>Architecture as regulation, partitioned.</b> Lessig’s claim about regulative effect is separated from the claim that trained models cannot be audited against rules; the separation identifies the inspectable deployment layer as the place where regulation should attach.",
        "<b>A bounded analogy for confident error.</b> Machine and human confident error are treated as functionally, not mechanistically, alike: both express confidence that the evidence does not warrant, and in both the defect is invisible at the point of use.",
        "<b>A procedural standard of care.</b> Dialectical review specifies clinical AI oversight as a performed and recorded act rather than an available capability, through four conditions (D1–D4) that close the gap between <i>reviewable</i> and <i>reviewed</i>.",
        "<b>An allocation rule with an evidentiary record.</b> A three-tier rule states the duties of vendor, institution, and clinician, and the recorded disposition becomes the evidence against which their discharge is assessed.",
        "<b>Application and limits.</b> The conditions are applied to nurse-facing deterioration alerting through a worked sepsis case, the framing is tested against the patient’s position, and the proposal is offered as piloted policy under evaluation rather than as a general mandate."
      ]
    },
    {
      "type": "group",
      "title": "The Oversight Gap",
      "blocks": [
        {
          "type": "text",
          "align": "justify",
          "body": "United States and European Union law both make the reviewing clinician load-bearing, yet each specifies the clinician’s role largely at the level of <i>capability</i> rather than <i>conduct</i>. The United States clinical decision support exclusion asks whether software enables a clinician to independently review the basis for its recommendations. Article 14 of the EU AI Act requires that oversight personnel be enabled to remain aware of automation bias, and Article 26 obliges deployers to assign competent overseers, monitor operation, and retain the system’s logs; those logs record system activity, not the clinician’s reasoning. No provision requires that the reviewing judgment be formed independently of the output, that it be recorded, or that consequences follow when it is not. A deployment can therefore satisfy both regimes as written while every recommendation it issues is accepted without examination. The mechanism is documented in controlled studies."
        },
        {
          "type": "table",
          "caption": "<b>Automation bias in mammography.</b> Reader accuracy with correct and incorrect purported AI BI-RADS suggestions in a study of 27 radiologists (Dratsch et al. 2023).",
          "columns": [
            {
              "header": "Readers",
              "align": "left"
            },
            {
              "header": "Correct AI<br>suggestions (%)"
            },
            {
              "header": "Incorrect AI<br>suggestions (%)"
            }
          ],
          "rows": [
            {
              "cells": [
                "Inexperienced",
                "79.7",
                "19.8"
              ]
            },
            {
              "cells": [
                "Highly experienced (almost eleven years on average)",
                "82.3",
                "45.5"
              ]
            }
          ]
        },
        {
          "type": "text",
          "align": "justify",
          "body": "Explanation, the instrument on which both regimes chiefly rely, can make matters worse when the recommendation is wrong: among 220 clinicians selecting antidepressants, incorrect recommendations paired with feature-level explanations significantly reduced accuracy (Jacobs et al. 2021). These experiments use simulated cases and manipulated advice; they show that the failure mode exists and can be induced, not how often recommendations go unreviewed in actual deployments. The data needed to establish the latter are not routinely captured, because a compliant deployment need not record whether review occurred."
        }
      ]
    },
    {
      "type": "group",
      "title": "Scoping the Argument",
      "blocks": [
        {
          "type": "text",
          "align": "justify",
          "body": "“Clinical AI” names a category too broad to support a unified normative conclusion, so the argument is scoped to three classes of deployed systems, which differ in regulatory posture, characteristic failure, and the oversight they require. Across all three, the governance-relevant invariant is not fabrication but <i>unwarranted expressed confidence</i>."
        },
        {
          "type": "table",
          "caption": "<b>Table 1.</b> Three classes of deployed clinical AI. Hallucination is a Class C phenomenon; Classes A and B fail differently. All three converge on one governance-relevant invariant: they emit assertions whose expressed confidence is not a reliable guide to correctness. Conditions D1–D4 are defined under <i>Dialectical Review</i> below. Deployments and pathways: Abràmoff et al. (2018); Wong et al. (2021); DEN180001 (U.S. FDA 2018); K253281 (U.S. FDA 2025).",
          "columns": [
            {
              "header": "Class",
              "align": "left"
            },
            {
              "header": "Representative<br>deployment"
            },
            {
              "header": "Typical<br>pathway"
            },
            {
              "header": "Characteristic<br>failure"
            },
            {
              "header": "Oversight<br>posture"
            }
          ],